<?xml version="1.0" encoding="UTF-8" standalone="no"?>
<servico xmlns="http://servicos.gov.br/v3/schema" xmlns:xsi="http://www.w3.org/2001/XMLSchema-instance" xsi:schemaLocation="http://servicos.gov.br/v3/schema ../servico.xsd">
    <nome>PagarDarf da Secretaria de Patrimônio da União</nome>
    <sigla/>
    <nomes-populares/>
    <descricao><![CDATA[O Documento de Arrecadação de Receitas Federais – DARF é utilizado para recolhimento, junto aos bancos autorizados, da taxa de ocupação ou foro dos imóveis da União, além de outros débitos de caráter extraordinário. Nele serão impressos os dados de identificação do imóvel, do titular ocupante ou foreiro, a data de pagamento e os respectivos valores, a serem recolhidos ao Tesouro Nacional.]]></descricao>
    <contato/>
    <gratuito>false</gratuito>
    <solicitantes>
        <solicitante>
            <tipo>Usuários de imóveis da união</tipo>
            <requisitos/>
        </solicitante>
    </solicitantes>
    <tempo-total-estimado>
        <descricao/>
    </tempo-total-estimado>
    <etapas>
        <etapa>
            <titulo>Pagamento de Darf</titulo>
            <descricao/>
            <documentos>
                <default>
                    <item>RIP</item>
                    <item>cpf ou cnpj</item>
                </default>
            </documentos>
            <custos>
                <default/>
            </custos>
            <canais-de-prestacao>
                <default/>
            </canais-de-prestacao>
        </etapa>
    </etapas>
    <orgao id=""/>
    <segmentos-da-sociedade/>
    <areas-de-interesse/>
    <palavras-chave/>
    <legislacoes/>
</servico>
