<?xml version="1.0" encoding="UTF-8" standalone="no"?>
<servico xmlns="http://servicos.gov.br/v3/schema" xmlns:xsi="http://www.w3.org/2001/XMLSchema-instance" xsi:schemaLocation="http://servicos.gov.br/v3/schema ../servico.xsd">
    <nome>Extrato do Processamento da DIPJ</nome>
    <sigla/>
    <nomes-populares/>
    <descricao>Visualizar a relação das últimas declarações DIPJ (Declaração de Informações Econômico-Fiscais da Pessoa Jurídica) entregues e realizar algumas consultas específicas.

* [Mais informações](http://www.receita.fazenda.gov.br/PessoaJuridica/DIPJ/2013/PergResp/default.htm): Orientações gerais sobre o serviço

* [Serviços relacionados](http://www.receita.fazenda.gov.br/aplicacoes/atbhe/tus/default.aspx?/a/6): Ver todos os serviços do assunto "Declarações e Demonstrativos"</descricao>
    <gratuito/>
    <solicitantes/>
    <tempo-total-estimado>
        <descricao/>
    </tempo-total-estimado>
    <etapas>
        <etapa>
            <titulo/>
            <descricao/>
            <documentos>
                <default/>
            </documentos>
            <custos>
                <default/>
            </custos>
            <canais-de-prestacao>
                <default>
                    <canal-de-prestacao tipo="web">
                        <descricao>https://www.receita.fazenda.gov.br/Aplicacoes/SSL/ATRJO/consProcess/Index.asp</descricao>
                    </canal-de-prestacao>
                    <canal-de-prestacao tipo="web">
                        <descricao>[Internet (via Portal e-CAC com certificado digital)](https://cav.receita.fazenda.gov.br/eCAC/publico/login.aspx?sistema=00013)</descricao>
                    </canal-de-prestacao>
                </default>
            </canais-de-prestacao>
        </etapa>
    </etapas>
    <orgao id="secretaria-da-receita-federal-do-brasil-rfb"/>
    <segmentos-da-sociedade>
        <item>Empresas</item>
    </segmentos-da-sociedade>
    <areas-de-interesse>
        <item>Economia e Finanças</item>
    </areas-de-interesse>
    <palavras-chave/>
    <legislacoes/>
</servico>
