<?xml version="1.0" encoding="UTF-8" standalone="no"?>
<servico xmlns="http://servicos.gov.br/v3/schema" xmlns:xsi="http://www.w3.org/2001/XMLSchema-instance" xsi:schemaLocation="http://servicos.gov.br/v3/schema ../servico.xsd">
    <nome>Exclusão do Simples Nacional</nome>
    <sigla/>
    <nomes-populares/>
    <descricao>Comunicar a exclusão do Simples Nacional.
</descricao>
    <gratuito/>
    <solicitantes/>
    <tempo-total-estimado>
        <descricao/>
    </tempo-total-estimado>
    <etapas>
        <etapa>
            <titulo/>
            <descricao/>
            <documentos>
                <default/>
            </documentos>
            <custos>
                <default/>
            </custos>
            <canais-de-prestacao>
                <default>
                    <canal-de-prestacao tipo="web">
                        <descricao>http://www8.receita.fazenda.gov.br/SIMPLESNACIONAL/Servicos/Grupo.aspx?grp=6</descricao>
                    </canal-de-prestacao>
                </default>
            </canais-de-prestacao>
        </etapa>
    </etapas>
    <orgao id="secretaria-da-receita-federal-do-brasil-rfb"/>
    <segmentos-da-sociedade>
        <item>Empresas</item>
    </segmentos-da-sociedade>
    <areas-de-interesse>
        <item>Economia e Finanças</item>
    </areas-de-interesse>
    <palavras-chave/>
    <legislacoes/>
</servico>
