<?xml version="1.0" encoding="UTF-8" standalone="yes"?>
<servico xsi:schemaLocation="http://servicos.gov.br/v3/schema.../servico.xsd" xmlns="http://servicos.gov.br/v3/schema" xmlns:xsi="http://www.w3.org/2001/XMLSchema-instance">
    <id>obter-aprovacao-do-boletim-mensal-de-producao</id>
    <dbId>3331</dbId>
    <nome>Obter aprovação do Boletim Mensal de Produção</nome>
    <sigla></sigla>
    <descricao>Consiste em: (i) receber dos Operadores de Contrato de Contrato de Concessão, Partilha e Cessão Onerosa a(s) o BMP; (ii) analisar o BMP; e (iii) publicar no site da ANP o ato administrativo.</descricao>
    <contato></contato>
    <gratuito>true</gratuito>
    <porcentagem-manual>false</porcentagem-manual>
    <servico-digital>false</servico-digital>
    <link-servico-digital></link-servico-digital>
    <solicitantes>
        <solicitante id="3918">
            <tipo>Operadores de Contrato de Contrato de Concessão, Partilha e Cessão Onerosa</tipo>
            <requisitos></requisitos>
        </solicitante>
    </solicitantes>
    <tempo-total-estimado>
        <entre min="31" max="60" unidade="dias-corridos"/>
        <descricao></descricao>
    </tempo-total-estimado>
    <validade-documento>
        <descricao></descricao>
    </validade-documento>
    <etapas>
        <etapa id="7447">
            <titulo>Solicitar aprovação</titulo>
            <descricao></descricao>
            <documentos>
                <default>
                    <item id="10567">Boletim Mensal de Produção</item>
                </default>
            </documentos>
            <custos>
                <default/>
            </custos>
            <canais-de-prestacao>
                <default>
                    <canal-de-prestacao id="7885" tipo="presencial">
                        <descricao>**Agência Nacional de Petróleo, Gás Natural e Biocombustíveis** - Av. Rio Branco, 65 / 22º andar - 20090-004 - Rio de Janeiro - RJ</descricao>
                    </canal-de-prestacao>
                </default>
            </canais-de-prestacao>
        </etapa>
    </etapas>
    <orgao id="http://estruturaorganizacional.dados.gov.br/id/unidade-organizacional/25281" dbId="917">
        <nomeOrgao>Agência Nacional do Petróleo, Gás Natural e Biocombustíveis (ANP)</nomeOrgao>
    </orgao>
    <segmentos-da-sociedade>
        <item idSegmento="3" idServicoSegmento="7373">Empresas</item>
    </segmentos-da-sociedade>
    <areas-de-interesse>
        <item>Energia</item>
    </areas-de-interesse>
    <palavras-chave>
        <item id="13706">anp</item>
        <item id="13707">aprovação</item>
        <item id="13708">boletim mensal</item>
    </palavras-chave>
</servico>
