<?xml version="1.0" encoding="UTF-8" standalone="yes"?>
<servico xsi:schemaLocation="http://servicos.gov.br/v3/schema.../servico.xsd" xmlns="http://servicos.gov.br/v3/schema" xmlns:xsi="http://www.w3.org/2001/XMLSchema-instance">
    <id>credenciar-psicologo-para-emissao-de-comprovante-de-aptidao-psicologica-para-manuseio-de-armas-de-fogo</id>
    <dbId>2350</dbId>
    <nome>Credenciar psicólogo para emissão de comprovante de aptidão psicológica para manuseio de armas de fogo</nome>
    <sigla></sigla>
    <nomes-populares>
        <item id="1911">Credenciamento de psicólogo para realizarem avaliação psicológica para manuseio de arma de fogo</item>
    </nomes-populares>
    <descricao>É o documento que autoriza psicólogos devidamente habilitados a realizar avaliações e emitir laudos para comprovação de aptidão psicológica para o manuseio de arma de fogo. Deve solicitar o credenciamento em uma unidade da PF mediante formulário próprio.</descricao>
    <contato></contato>
    <gratuito>true</gratuito>
    <porcentagem-manual>false</porcentagem-manual>
    <servico-digital>false</servico-digital>
    <link-servico-digital></link-servico-digital>
    <solicitantes>
        <solicitante id="2904">
            <tipo>Psicólogos, empresas e instituições que precisam expedir o comprovante de aptidão psicológica para manuseio de armas de fogo.</tipo>
            <requisitos></requisitos>
        </solicitante>
    </solicitantes>
    <tempo-total-estimado>
        <nao-estimado-ainda/>
        <descricao></descricao>
    </tempo-total-estimado>
    <validade-documento>
        <descricao></descricao>
    </validade-documento>
    <etapas>
        <etapa id="5659">
            <titulo>Requerer credenciamento</titulo>
            <descricao>Para obter modelo do formulário, clique [aqui](http://www.pf.gov.br/servicos-pf/armas/credenciamento-psicologos/requerimento-para-credenciamento-de-psicologo.pdf)</descricao>
            <documentos>
                <default>
                    <item id="6616">Carteira de identidade</item>
                    <item id="6617">Carteira de trabalho</item>
                    <item id="6618">Certificado de antecedentes criminais fornecidas pela Justiça Federal, Estadual, Militar e Eleitoral e de não estar respondendo a inquérito policial ou a processo criminal, que poderão ser fornecidas por meios eletrônicos.</item>
                    <item id="6619">Certificado de conclusão de curso</item>
                    <item id="6620">Comprovante de quitação eleitoral</item>
                    <item id="6621">CPF</item>
                    <item id="6622">Diploma</item>
                    <item id="6623">Fotos do consultório/Clinica</item>
                    <item id="6624">Documentação legal do consultório/clínica</item>
                    <item id="6631">Formulário preenchido</item>
                    <item id="6632">Foto 3x4 recente</item>
                    <item id="6633">Comprovante de inscrição ativa e regular no Conselho Regional de Psicologia e certidão negativa de infrações éticas do respectivo Conselho</item>
                    <item id="6634">Comprovante de que possui pelo menos dois anos de efetivo exercício na profissão de psicólogo;</item>
                    <item id="6635">Certificado que ateste sua aptidão para a aplicação dos instrumentos psicológicos previstos nos incisos I e II do art. 5º da IN 78/2014-DG/PF (testes expressivo e projetivo)</item>
                </default>
            </documentos>
            <custos>
                <default/>
            </custos>
            <canais-de-prestacao>
                <default>
                    <canal-de-prestacao id="5490" tipo="presencial">
                        <descricao>Em uma [Superintendência ou Delegacia da Polícia Federal](http://www.pf.gov.br/institucional/unidades/superintendencias-e-delegacias)</descricao>
                    </canal-de-prestacao>
                </default>
            </canais-de-prestacao>
        </etapa>
        <etapa id="5660">
            <titulo>Participar  das entrevistas</titulo>
            <descricao></descricao>
            <documentos>
                <default>
                    <item id="6625">Carteira de identidade</item>
                    <item id="6626">Carteira de trabalho</item>
                </default>
            </documentos>
            <custos>
                <default/>
            </custos>
            <canais-de-prestacao>
                <default>
                    <canal-de-prestacao id="5491" tipo="presencial">
                        <descricao>Em uma [Superintendência ou Delegacia da Polícia Federal](http://www.pf.gov.br/institucional/unidades/superintendencias-e-delegacias)</descricao>
                    </canal-de-prestacao>
                </default>
            </canais-de-prestacao>
        </etapa>
        <etapa id="5661">
            <titulo>Agendar retirada do documento</titulo>
            <descricao></descricao>
            <documentos>
                <default>
                    <item id="6627">Carteira de identidade</item>
                    <item id="6628">Carteira de trabalho</item>
                </default>
            </documentos>
            <custos>
                <default/>
            </custos>
            <canais-de-prestacao>
                <default>
                    <canal-de-prestacao id="5492" tipo="presencial">
                        <descricao>Em uma [Superintendência ou Delegacia da Polícia Federal](http://www.pf.gov.br/institucional/unidades/superintendencias-e-delegacias)</descricao>
                    </canal-de-prestacao>
                </default>
            </canais-de-prestacao>
        </etapa>
        <etapa id="5662">
            <titulo>Receber documentos</titulo>
            <descricao></descricao>
            <documentos>
                <default>
                    <item id="6629">Carteira de identidade</item>
                    <item id="6630">Carteira de trabalho</item>
                </default>
            </documentos>
            <custos>
                <default/>
            </custos>
            <canais-de-prestacao>
                <default>
                    <canal-de-prestacao id="5493" tipo="presencial">
                        <descricao>Em uma [Superintendência ou Delegacia da Polícia Federal](http://www.pf.gov.br/institucional/unidades/superintendencias-e-delegacias)</descricao>
                    </canal-de-prestacao>
                </default>
            </canais-de-prestacao>
        </etapa>
    </etapas>
    <orgao id="http://estruturaorganizacional.dados.gov.br/id/unidade-organizacional/316" dbId="37532">
        <nomeOrgao>Ministério da Justiça e Segurança Pública (MJSP)</nomeOrgao>
    </orgao>
    <segmentos-da-sociedade>
        <item idSegmento="1" idServicoSegmento="5622">Cidadãos</item>
        <item idSegmento="3" idServicoSegmento="5623">Empresas</item>
        <item idSegmento="2" idServicoSegmento="5624">Órgãos e entidades públicas</item>
    </segmentos-da-sociedade>
    <areas-de-interesse>
        <item>Fiscalização do Estado</item>
        <item>Segurança e Ordem Pública</item>
        <item>Saúde</item>
        <item>Defesa militar</item>
    </areas-de-interesse>
    <palavras-chave>
        <item id="10756">psicologia</item>
        <item id="10757">estatuto do desarmamento</item>
        <item id="10758">credenciamento</item>
    </palavras-chave>
</servico>
