<?xml version="1.0" encoding="UTF-8" standalone="no"?>
<servico xmlns="http://servicos.gov.br/v3/schema" xmlns:xsi="http://www.w3.org/2001/XMLSchema-instance" xsi:schemaLocation="http://servicos.gov.br/v3/schema ../servico.xsd">
    <nome>Extratos de pagamentos de benefícios Previdenciários</nome>
    <sigla/>
    <nomes-populares/>
    <descricao>Emite o extrato dos pagamentos recebidos pelo beneficiário previdenciários, junto ao INSS.

* [Telefone](undefined): Ligue 135 para obter mais informações.</descricao>
    <gratuito/>
    <solicitantes/>
    <tempo-total-estimado>
        <descricao/>
    </tempo-total-estimado>
    <etapas>
        <etapa>
            <titulo/>
            <descricao/>
            <documentos>
                <default/>
            </documentos>
            <custos>
                <default/>
            </custos>
            <canais-de-prestacao>
                <default>
                    <canal-de-prestacao tipo="web">
                        <descricao>http://agencia.previdencia.gov.br/e-aps/servico/144</descricao>
                    </canal-de-prestacao>
                </default>
            </canais-de-prestacao>
        </etapa>
    </etapas>
    <orgao id="ministerio-da-previdencia-social-mps"/>
    <segmentos-da-sociedade>
        <item>Cidadãos</item>
    </segmentos-da-sociedade>
    <areas-de-interesse>
        <item>Previdência Social</item>
    </areas-de-interesse>
    <palavras-chave/>
    <legislacoes/>
</servico>
