<?xml version="1.0" encoding="UTF-8" standalone="no"?>
<servico xmlns="http://servicos.gov.br/v3/schema" xmlns:xsi="http://www.w3.org/2001/XMLSchema-instance" xsi:schemaLocation="http://servicos.gov.br/v3/schema ../servico.xsd">
    <nome><![CDATA[Realização de Recurso Contra Aplicação de Multa - DNIT]]></nome>
    <sigla>Recurso</sigla>
    <nomes-populares>
        <item>Recurso de Multa</item>
    </nomes-populares>
    <descricao><![CDATA[Processo administrativo, através do qual o interessado ou seu representante manifesta sua discordância da multa aplicada.]]></descricao>
    <contato/>
    <gratuito>true</gratuito>
    <solicitantes>
        <solicitante>
            <tipo>Qualquer cidadão que receba uma notificação de penalidade</tipo>
            <requisitos><![CDATA[Ter recebido a notificação de penalidade de uma multa DNIT]]></requisitos>
        </solicitante>
    </solicitantes>
    <tempo-total-estimado>
        <descricao><![CDATA[O prazo para interpor o recurso será aquele constante na notificação de penalidade para recolhimento de seu valor, não sendo este inferior a 30 (trinta) dias contados da data da notificação, isto é, da data em que o infrator recebeu a notificação de penalidade em seu domicílio, conforme determina o Art. 282 §4º, do [CTB](http://www.planalto.gov.br/ccivil_03/leis/L9503Compilado.htm)]]></descricao>
    </tempo-total-estimado>
    <etapas>
        <etapa>
            <titulo>Preencher formulário de recurso</titulo>
            <descricao><![CDATA[O condutor deve apresentar os fatos que achar prudentes para anular a penalidade.]]></descricao>
            <documentos>
                <default/>
            </documentos>
            <custos>
                <default/>
            </custos>
            <canais-de-prestacao>
                <default>
                    <canal-de-prestacao tipo="web">
                        <descricao><![CDATA[http://www.dnit.gov.br/rodovias/operacoes-rodoviarias/multas/multas-de-transito-aplicadas-pelo-dnit]]></descricao>
                    </canal-de-prestacao>
                </default>
            </canais-de-prestacao>
        </etapa>
    </etapas>
    <orgao id=""/>
    <segmentos-da-sociedade/>
    <areas-de-interesse/>
    <palavras-chave/>
    <legislacoes/>
</servico>
