<?xml version="1.0" encoding="UTF-8" standalone="no"?>
<servico xmlns="http://servicos.gov.br/v3/schema" xmlns:xsi="http://www.w3.org/2001/XMLSchema-instance" xsi:schemaLocation="http://servicos.gov.br/v3/schema ../servico.xsd">
    <nome>Certificado de Licença de Funcionamento (CLF) - Produtos Químicos</nome>
    <sigla/>
    <nomes-populares/>
    <descricao>É o documento que certifica que a pessoa jurídica em situação regular, ou pessoa física no caso de produtor rural, está devidamente registrada na Divisão de Controle de Produtos Químicos do Departamento de Polícia Federal.

Para obtê-lo, baixe o Programa Cadastro (vide "Formulários"), preencha as informações solicitadas de acordo com a Portaria 1.274/2003 (vide "Outros"), gere o arquivo com extensão XML que deverá ser salvo em um disquete ou CD, imprima o requerimento, e entregue-o juntamente com toda a documentação necessária em uma unidade da Polícia Federal (vide "Presencial").

* [Formulários](http://www.dpf.gov.br/servicos/gru/produtos-quimicos): GRU (FUNAD)

* [Formulários](http://www.dpf.gov.br/servicos/produtos-quimicos/programas/programa-cadastro): Programa Cadastro

* [Outros](http://www.dpf.gov.br/servicos/produtos-quimicos/legislacao/PORTARIA1274.pdf): Portaria 1.274/2003

* [Serviços relacionados](http://www.dpf.gov.br/servicos/produtos-quimicos/cadastro-e-licenca/renovacao-de-certificado-de-licenca-de-funcionamento): Renovação de Certificado de Licença de Funcionamento - CLF

* [Serviços relacionados](http://www.dpf.gov.br/servicos/produtos-quimicos/cadastro-e-licenca/atualizacao-de-produtos-quimicos): Atualização Cadastral de Produtos Químicos - Inclusão / Exclusão

* [Serviços relacionados](http://www.dpf.gov.br/servicos/produtos-quimicos/consultas/acompanhamento-de-processos): Acompanhamento de processos</descricao>
    <gratuito/>
    <solicitantes/>
    <tempo-total-estimado>
        <descricao/>
    </tempo-total-estimado>
    <etapas>
        <etapa>
            <titulo/>
            <descricao/>
            <documentos>
                <default/>
            </documentos>
            <custos>
                <default/>
            </custos>
            <canais-de-prestacao>
                <default>
                    <canal-de-prestacao tipo="web">
                        <descricao>http://www.dpf.gov.br/institucional/pf-pelo-brasil</descricao>
                    </canal-de-prestacao>
                </default>
            </canais-de-prestacao>
        </etapa>
    </etapas>
    <orgao id="ministerio-da-justica-mj"/>
    <segmentos-da-sociedade>
        <item>Cidadãos</item>
        <item>Empresas</item>
    </segmentos-da-sociedade>
    <areas-de-interesse>
        <item>Segurança e Ordem Pública</item>
    </areas-de-interesse>
    <palavras-chave/>
    <legislacoes/>
</servico>
