<?xml version="1.0" encoding="UTF-8" standalone="no"?>
<servico xmlns="http://servicos.gov.br/v3/schema" xmlns:xsi="http://www.w3.org/2001/XMLSchema-instance" xsi:schemaLocation="http://servicos.gov.br/v3/schema ../servico.xsd">
    <nome>Melhor em Casa - Assistência Domiciliar</nome>
    <sigla/>
    <nomes-populares/>
    <descricao>Pessoas com necessidade de reabilitação motora, idosos, pacientes crônicos sem agravamento ou em situação pós-cirúrgica, por exemplo, terão assistência multiprofissional gratuita em seus lares, com cuidados mais próximos da família.

O atendimento será feito por equipes multidisciplinares, formadas prioritariamente por médicos, enfermeiros, técnicos em enfermagem e fisioterapeuta. Outros profissionais (fonoaudiólogo, nutricionista, odontólogo, psicólogo e farmacêutico) poderão compor as equipes de apoio. Cada equipe poderá atender, em média, 60 pacientes, simultaneamente.</descricao>
    <gratuito/>
    <solicitantes/>
    <tempo-total-estimado>
        <descricao/>
    </tempo-total-estimado>
    <etapas>
        <etapa>
            <titulo/>
            <descricao/>
            <documentos>
                <default/>
            </documentos>
            <custos>
                <default/>
            </custos>
            <canais-de-prestacao>
                <default>
                    <canal-de-prestacao tipo="web">
                        <descricao>http://sage.saude.gov.br/?link=melhorCasa&amp;flt=true&amp;param=null</descricao>
                    </canal-de-prestacao>
                </default>
            </canais-de-prestacao>
        </etapa>
    </etapas>
    <orgao id="http://estruturaorganizacional.dados.gov.br/id/unidade-organizacional/304"/>
    <segmentos-da-sociedade/>
    <areas-de-interesse>
        <item>Humanização na saúde</item>
        <item>Saúde</item>
        <item>Saúde dos portadores de deficiências</item>
    </areas-de-interesse>
    <palavras-chave/>
    <legislacoes/>
</servico>
