<?xml version="1.0" encoding="UTF-8" standalone="no"?>
<servico xmlns="http://servicos.gov.br/v3/schema" xmlns:xsi="http://www.w3.org/2001/XMLSchema-instance" xsi:schemaLocation="http://servicos.gov.br/v3/schema ../servico.xsd">
    <nome>Entrega voluntária de armas de fogo - Campanha Nacional do Desarmamento</nome>
    <sigla/>
    <nomes-populares/>
    <descricao>Os proprietários ou possuidores de arma(s) de fogo, com ou sem registro, podem entregá-la(s) à Polícia Federal ou às instituições credenciadas para destruição. Ao entregar uma arma, o cidadão não precisará se identificar e receberá indenização que varia de R$ 150,00 a R$ 450,00, conforme o tipo da arma entregue.

A Campanha Nacional do Desarmamento busca a mobilização da sociedade brasileira para retirar de circulação o maior número possível de armas de fogo. A entrega é voluntária e pode ser feita em mais de 2 mil postos de coleta em todo o Brasil.

Para a entrega de uma arma, o cidadão deverá seguir os seguintes procedimentos:

1. Acessar o site da Campanha e emitir a guia de trânsito (Vide "Emissão da guia de trânsito");
2. Dirigir-se até um posto credenciado de entrega voluntária (Vide "Localize o posto de entrega voluntária de armas mais próximo de você") com a guia de trânsito e a arma desmuniciada (descarregada) e embalada, bem como documento de registro de arma de fogo (caso disponível);
3. Ao efetuar a entrega, o agente de segurança fará o recebimento via Sistema Desarma e solicitará ao cidadão o cadastramento de uma senha com 4 dígitos para recebimento da indenização;
4. Finalizado o cadastro via sistema, o cidadão receberá um documento de entrega da arma, que conterá um código de indenização com 16 dígitos;
5. Após 24h da entrega e no prazo máximo de 30 dias, o cidadão deverá se dirigir a um autoatendimento do Banco do Brasil para o saque da indenização. Para isso, é necessário apenas o código de indenização (16 dígitos) e a senha cadastrada (4 dígitos);

* [Mais informações](undefined): Qualquer problema no processo deverá ser comunicado por e-mail: desarmamento@mj.gov.br

* [Telefone](undefined): (61) 2025-9125

* [Formulários](http://desarma.mj.gov.br/SisDesarmamento/formulario/portador.do): Emissão da Guia de Trânsito

* [Serviços relacionados](http://www.dpf.gov.br/servicos/armas/comunicacao-de-ocorrencias): Comunicação de ocorrências envolvendo Arma de Fogo

* [Mais informações](http://www.dpf.gov.br/servicos/armas/): Sobre Armas de Fogo</descricao>
    <gratuito/>
    <solicitantes/>
    <tempo-total-estimado>
        <descricao/>
    </tempo-total-estimado>
    <etapas>
        <etapa>
            <titulo/>
            <descricao/>
            <documentos>
                <default/>
            </documentos>
            <custos>
                <default/>
            </custos>
            <canais-de-prestacao>
                <default>
                    <canal-de-prestacao tipo="web">
                        <descricao>http://www.dpf.gov.br/simba/armas/campanha-do-desarmamento/entrega-de-arma-de-fogo</descricao>
                    </canal-de-prestacao>
                </default>
            </canais-de-prestacao>
        </etapa>
    </etapas>
    <orgao id="http://estruturaorganizacional.dados.gov.br/id/unidade-organizacional/316"/>
    <segmentos-da-sociedade>
        <item>Cidadãos</item>
    </segmentos-da-sociedade>
    <areas-de-interesse>
        <item>Proteção social</item>
    </areas-de-interesse>
    <palavras-chave/>
    <legislacoes/>
</servico>
