<?xml version="1.0" encoding="UTF-8" standalone="no"?>
<servico xmlns="http://servicos.gov.br/v3/schema" xmlns:xsi="http://www.w3.org/2001/XMLSchema-instance" xsi:schemaLocation="http://servicos.gov.br/v3/schema ../servico.xsd">
    <nome>Consulta Parcelamentos Deferidos no Âmbito da Receita Federal</nome>
    <sigla/>
    <nomes-populares/>
    <descricao>Consultar relação de parcelamentos concedidos no âmbito da Receita Federal por contribuinte.</descricao>
    <gratuito/>
    <solicitantes/>
    <tempo-total-estimado>
        <descricao/>
    </tempo-total-estimado>
    <etapas>
        <etapa>
            <titulo/>
            <descricao/>
            <documentos>
                <default/>
            </documentos>
            <custos>
                <default/>
            </custos>
            <canais-de-prestacao>
                <default>
                    <canal-de-prestacao tipo="web">
                        <descricao>http://www.receita.fazenda.gov.br/Aplicacoes/ATSPO/Parcelamento/default.htm</descricao>
                    </canal-de-prestacao>
                </default>
            </canais-de-prestacao>
        </etapa>
    </etapas>
    <orgao id="http://estruturaorganizacional.dados.gov.br/id/unidade-organizacional/77"/>
    <segmentos-da-sociedade>
        <item>Cidadãos</item>
        <item>Empresas</item>
    </segmentos-da-sociedade>
    <areas-de-interesse>
        <item>Economia e Finanças</item>
    </areas-de-interesse>
    <palavras-chave/>
    <legislacoes/>
</servico>
