<?xml version="1.0" encoding="UTF-8" standalone="yes"?>
<servico xsi:schemaLocation="http://servicos.gov.br/v3/schema.../servico.xsd" xmlns="http://servicos.gov.br/v3/schema" xmlns:xsi="http://www.w3.org/2001/XMLSchema-instance">
    <id>obter-autorizacao-da-ancine-para-realizar-filmagem-estrangeira-no-brasil</id>
    <dbId>4164</dbId>
    <nome>Obter autorização da ANCINE para realizar filmagem estrangeira no Brasil</nome>
    <sigla></sigla>
    <nomes-populares>
        <item id="3182">Filmagem Estrangeira no Brasil</item>
    </nomes-populares>
    <descricao>Recebimento e processamento das comunicações de filmagem/produção de obras estrangeiras a serem realizadas no território nacional. A comunicação é realizada por empresa produtora brasileira registrada na ANCINE que possua instrumento contratual firmado com a empresa produtora estrangeira.</descricao>
    <contato></contato>
    <gratuito>true</gratuito>
    <porcentagem-manual>false</porcentagem-manual>
    <servico-digital>false</servico-digital>
    <link-servico-digital></link-servico-digital>
    <solicitantes>
        <solicitante id="5169">
            <tipo>Produtores de filmagem.</tipo>
            <requisitos>Requisitos necessários para o solicitante:

- Registro de produtora brasileira junto à ANCINE; 
- Instrumento contratual entre a empresa produtora estrangeira e a empresa produtora brasileira.</requisitos>
        </solicitante>
    </solicitantes>
    <tempo-total-estimado>
        <ate max="5" unidade="dias-uteis"/>
        <descricao></descricao>
    </tempo-total-estimado>
    <validade-documento>
        <descricao></descricao>
    </validade-documento>
    <etapas>
        <etapa id="9287">
            <titulo>Solicitação de Filmagem Estrangeira no Brasil</titulo>
            <descricao>Envio de requerimento próprio, intitulado “Comunicação de Produção de Obra Audiovisual Estrangeira em Território Nacional[LMLG1] ”,acompanhado da documentação listada no art. 2º da Instrução Normativa nº 79 da ANCINE, de 15/10/2008;
Análise da documentação pelo setor responsável;
Acatamento da comunicação, rejeição ou formulação de exigências;
Emissão de ofício, certificando a comunicação, se houver acatamento;
Envio do ofício à produtora brasileira e às competentes representações</descricao>
            <documentos>
                <default>
                    <item id="13483">Formulário de comunicação de produção de obra audiovisual estrangeira no território nacional, anexo à Instrução Normativa nº 79 e disponível em http://www.ancine.gov.br/media/Formulario1IN79art2.doc;</item>
                    <item id="13484">Cópia do contrato firmado entre a empresa produtora estrangeira, ou responsável legal pelo empreendimento, e a empresa produtora brasileira, com indicação das responsabilidades recíprocas, forma de remuneração acordada e o período de validade do instrumento; 
Cópia da tradução do contrato acima citado, quando em idioma estrangeiro;</item>
                    <item id="13485">Plano provisório de filmagem/gravação, com a indicação de datas e dos locais (Município/UF), no território brasileiro, onde se realizarão os trabalhos; 
Cópia das folhas de identificação do passaporte de cada profissional estrangeiro.</item>
                </default>
            </documentos>
            <custos>
                <default/>
            </custos>
            <tempo-total-estimado>
                <ate max="5" unidade="dias-uteis"/>
            </tempo-total-estimado>
            <canais-de-prestacao>
                <default>
                    <canal-de-prestacao id="10166" tipo="e-mail">
                        <descricao>filmagem.estrangeira@ancine.gov.br</descricao>
                    </canal-de-prestacao>
                </default>
            </canais-de-prestacao>
        </etapa>
    </etapas>
    <orgao id="http://estruturaorganizacional.dados.gov.br/id/unidade-organizacional/57682" dbId="916">
        <nomeOrgao>Agência Nacional do Cinema (ANCINE)</nomeOrgao>
    </orgao>
    <segmentos-da-sociedade>
        <item idSegmento="3" idServicoSegmento="8989">Empresas</item>
    </segmentos-da-sociedade>
    <areas-de-interesse>
        <item>Difusão Cultural</item>
        <item>Cooperação Internacional</item>
        <item>Relações Internacionais</item>
        <item>Cultura</item>
    </areas-de-interesse>
    <palavras-chave>
        <item id="17094">Filmagem Estrangeira no Brasil</item>
        <item id="17095">produção audiovisual estrangeira no Brasil</item>
        <item id="17096">produção audiovisual brasileira com participa</item>
        <item id="17097">filmagem estrangeira no país</item>
    </palavras-chave>
    <legislacoes>
        <item id="3099">Instrução Normativa nº 79 da ANCINE, de 15 de outubro de 2008</item>
    </legislacoes>
    <condicoes-acessibilidade>..</condicoes-acessibilidade>
    <tratamento-prioritario>..</tratamento-prioritario>
    <tratamento-dispensado-atendimento>Esse serviço não se aplica a produções estrangeiras de obra jornalística. O ofício também é produzido no caso de filmagens brasileiras que envolvam a participação de profissionais estrangeiros, de forma a facilitar a emissão do visto para estes profissionais.</tratamento-dispensado-atendimento>
</servico>
